{
  "schema_version": "1",
  "frames": 130,
  "events": [
    {"tick": 0, "action": "decoy", "kind": "tap"},
    {"tick": 4, "action": "collect", "kind": "tap"},
    {"tick": 30, "action": "collect", "kind": "tap"},
    {"tick": 85, "action": "collect", "kind": "tap"}
  ],
  "assertions": [
    {"tick": 0, "kind": "position", "scene": "play", "group": "probe", "index": 0, "expected": [0, 0.0013333333333333333], "tolerance": 0.00001},
    {"tick": 1, "kind": "position", "scene": "play", "group": "probe", "index": 0, "expected": [0, 0.0026666666666666666], "tolerance": 0.00001},
    {"tick": 3, "kind": "entity_active", "scene": "play", "group": "packet_slots", "index": 0, "active": false},
    {"tick": 3, "kind": "runtime_metric", "metric": "pool_expirations", "op": "ge", "value": 1},
    {"tick": 3, "kind": "runtime_metric", "metric": "pool_exhaustions", "op": "ge", "value": 1},
    {"tick": 4, "kind": "entity_active", "scene": "play", "group": "packet_slots", "index": 0, "active": true},
    {"tick": 4, "kind": "int_state", "state": "packet_spawn_ok", "op": "eq", "value": 1},
    {"tick": 4, "kind": "int_state", "state": "packet_second_ok", "op": "eq", "value": 0},
    {"tick": 20, "kind": "position", "scene": "play", "group": "effect_slots", "index": 0, "expected": [0.2, 0.027], "tolerance": 0.00001},
    {"tick": 80, "kind": "velocity", "scene": "play", "group": "hazard", "index": 0, "expected": [-6, 0], "tolerance": 0.00001},
    {"tick": 129, "kind": "current_scene", "scene": "victory"},
    {"tick": 129, "kind": "int_state", "state": "score", "op": "eq", "value": 3},
    {"tick": 129, "kind": "int_state", "state": "health", "op": "ge", "value": 1},
    {"tick": 129, "kind": "int_state", "state": "danger", "op": "eq", "value": 0},
    {"tick": 129, "kind": "int_state", "state": "clearances", "op": "ge", "value": 1},
    {"tick": 129, "kind": "int_state", "state": "packet_release_ok", "op": "eq", "value": 1},
    {"tick": 129, "kind": "int_state", "state": "effect_spawn_ok", "op": "eq", "value": 1},
    {"tick": 129, "kind": "runtime_metric", "metric": "collision_contacts", "op": "ge", "value": 1},
    {"tick": 129, "kind": "runtime_metric", "metric": "contact_begins", "op": "ge", "value": 4},
    {"tick": 129, "kind": "runtime_metric", "metric": "contact_ends", "op": "ge", "value": 1},
    {"tick": 129, "kind": "runtime_metric", "metric": "stale_contact_events", "op": "eq", "value": 0},
    {"tick": 129, "kind": "runtime_metric", "metric": "motion_segments", "op": "ge", "value": 200},
    {"tick": 129, "kind": "runtime_metric", "metric": "linear_motion_updates", "op": "ge", "value": 100},
    {"tick": 129, "kind": "runtime_metric", "metric": "pool_acquire_attempts", "op": "ge", "value": 14},
    {"tick": 129, "kind": "runtime_metric", "metric": "pool_acquire_successes", "op": "ge", "value": 10},
    {"tick": 129, "kind": "runtime_metric", "metric": "pool_releases", "op": "ge", "value": 3},
    {"tick": 129, "kind": "runtime_metric", "metric": "pool_exhaustions", "op": "ge", "value": 7},
    {"tick": 129, "kind": "runtime_metric", "metric": "pool_recycled_slots", "op": "ge", "value": 3},
    {"tick": 129, "kind": "runtime_metric", "metric": "pool_expirations", "op": "ge", "value": 3},
    {"tick": 129, "kind": "runtime_metric", "metric": "pool_lifetime_checks", "op": "ge", "value": 1},
    {"tick": 129, "kind": "runtime_metric", "metric": "peak_active_pooled_entities", "op": "ge", "value": 2}
  ]
}
